{
  "creator_id": "creator-001",
  "campaign_id": "campaign-001",
  "qualification_summary": "Strong audience, brand, and deliverable fit with reliability unknown before the campaign.",
  "campaign_operating_experience": "Communication was clear and revisions stayed within scope.",
  "content_quality": "Final asset met the approved brief and production requirements.",
  "approval_performance": "Passed quality and final approval after one brief-aligned revision.",
  "delivery_reliability": "Final delivery arrived by the approved due date.",
  "rights_flexibility": "Paid media and brand usage were approved for the campaign term.",
  "audience_response": "Watch and engagement behavior supported continued testing.",
  "business_results": "The campaign produced attributable purchases and revenue in the approved measurement source.",
  "cost_efficiency": "Cost efficiency met the campaign's approved test threshold.",
  "reusable_learning": "Retain the demonstration format and test a new opening hook next.",
  "decision": "retest_new_variable"
}
